{
  "schema": 1,
  "generated_by": "baton sync 0.1.3",
  "upstreams": {
    "speckit": {
      "package": "specify-cli",
      "version": "1.0.11",
      "repo": "github/spec-kit",
      "tag": "v1.0.11",
      "commit": "8147943512404afb9d99c6252cb9bf84369fd0b0",
      "requirements": "baton/upstream/specify-cli.requirements.txt",
      "requirements_sha256": "5e6f1d40a80b984138e816e148f331659e6de3363a7df1160b62b66eb99ee8ff",
      "license": "MIT",
      "init_args": [
        "--integration",
        "copilot",
        "--script",
        "sh"
      ]
    },
    "atv": {
      "package": "atv-starterkit",
      "version": null,
      "repo": "All-The-Vibes/ATV-StarterKit",
      "ref": "main",
      "commit": "ad996736b879be87c7755df5c5017d5336203bbc",
      "tree": "777a37ef9cf15f3a6fd6a3355cc3c945e8bb1c47",
      "license": "MIT",
      "note": "pinned to main: v2.6.3 ships corrupted agent templates (fixed in f0a86ef)"
    }
  },
  "files": [
    {
      "path": ".github/agents/adversarial-reviewer.agent.md",
      "upstream": "atv",
      "upstream_path": "pkg/scaffold/templates/agents/adversarial-reviewer.agent.md",
      "stored_at": ".github/agents/adversarial-reviewer.agent.md",
      "sha256_upstream": "917c5d48e73d203f72b471341e99daa56360bd227fe611c148ab8e873fe72b0c",
      "sha256": "917c5d48e73d203f72b471341e99daa56360bd227fe611c148ab8e873fe72b0c",
      "license": "MIT",
      "repair": null,
      "packs": [
        "core"
      ]
    },
    {
      "path": ".github/agents/agent-native-reviewer.agent.md",
      "upstream": "atv",
      "upstream_path": "pkg/scaffold/templates/agents/agent-native-reviewer.agent.md",
      "stored_at": ".github/agents/agent-native-reviewer.agent.md",
      "sha256_upstream": "428604a28144b795c662f36f113c8cc5b973b18294ba71461fe2a92710e29d61",
      "sha256": "428604a28144b795c662f36f113c8cc5b973b18294ba71461fe2a92710e29d61",
      "license": "MIT",
      "repair": null,
      "packs": [
        "core"
      ]
    },
    {
      "path": ".github/agents/correctness-reviewer.agent.md",
      "upstream": "atv",
      "upstream_path": "pkg/scaffold/templates/agents/correctness-reviewer.agent.md",
      "stored_at": ".github/agents/correctness-reviewer.agent.md",
      "sha256_upstream": "4a8fbce14b4e6452ffe102c0c4e5887c3a502ce09e4265142ef289bdade9c841",
      "sha256": "4a8fbce14b4e6452ffe102c0c4e5887c3a502ce09e4265142ef289bdade9c841",
      "license": "MIT",
      "repair": null,
      "packs": [
        "core"
      ]
    },
    {
      "path": ".github/agents/learnings-researcher.agent.md",
      "upstream": "atv",
      "upstream_path": "pkg/scaffold/templates/agents/learnings-researcher.agent.md",
      "stored_at": ".github/agents/learnings-researcher.agent.md",
      "sha256_upstream": "b395b6c820c16ee574617a48f679f4dc247c857e39a11c0a8b04b341f6975391",
      "sha256": "b395b6c820c16ee574617a48f679f4dc247c857e39a11c0a8b04b341f6975391",
      "license": "MIT",
      "repair": null,
      "packs": [
        "core"
      ]
    },
    {
      "path": ".github/agents/maintainability-reviewer.agent.md",
      "upstream": "atv",
      "upstream_path": "pkg/scaffold/templates/agents/maintainability-reviewer.agent.md",
      "stored_at": ".github/agents/maintainability-reviewer.agent.md",
      "sha256_upstream": "f6650ebe8847c9a696813f56050f22cbf37f65ad0aafbae0dca7ea3878e61113",
      "sha256": "f6650ebe8847c9a696813f56050f22cbf37f65ad0aafbae0dca7ea3878e61113",
      "license": "MIT",
      "repair": null,
      "packs": [
        "core"
      ]
    },
    {
      "path": ".github/agents/project-standards-reviewer.agent.md",
      "upstream": "atv",
      "upstream_path": "pkg/scaffold/templates/agents/project-standards-reviewer.agent.md",
      "stored_at": ".github/agents/project-standards-reviewer.agent.md",
      "sha256_upstream": "e7acf7d84973a7d8c8fb4eda710ed16712b5d91e9b42a98200267b4acce93852",
      "sha256": "e7acf7d84973a7d8c8fb4eda710ed16712b5d91e9b42a98200267b4acce93852",
      "license": "MIT",
      "repair": null,
      "packs": [
        "core"
      ]
    },
    {
      "path": ".github/agents/repo-research-analyst.agent.md",
      "upstream": "atv",
      "upstream_path": "pkg/scaffold/templates/agents/repo-research-analyst.agent.md",
      "stored_at": ".github/agents/repo-research-analyst.agent.md",
      "sha256_upstream": "9c9cac8e051e61c64ac6ffab02cfd67074870a523ab07948da18bd023144bad0",
      "sha256": "9c9cac8e051e61c64ac6ffab02cfd67074870a523ab07948da18bd023144bad0",
      "license": "MIT",
      "repair": null,
      "packs": [
        "core"
      ]
    },
    {
      "path": ".github/agents/security-reviewer.agent.md",
      "upstream": "atv",
      "upstream_path": "pkg/scaffold/templates/agents/security-reviewer.agent.md",
      "stored_at": ".github/agents/security-reviewer.agent.md",
      "sha256_upstream": "28d19d73cddcb4c647ccfe70f3e66148035eb66c233310288981daf5574e9abc",
      "sha256": "28d19d73cddcb4c647ccfe70f3e66148035eb66c233310288981daf5574e9abc",
      "license": "MIT",
      "repair": null,
      "packs": [
        "core"
      ]
    },
    {
      "path": ".github/agents/testing-reviewer.agent.md",
      "upstream": "atv",
      "upstream_path": "pkg/scaffold/templates/agents/testing-reviewer.agent.md",
      "stored_at": ".github/agents/testing-reviewer.agent.md",
      "sha256_upstream": "7c768ff5556dcdc43feee879f4ff2f1aa9440178272efa68f4bd66aede6f92c5",
      "sha256": "7c768ff5556dcdc43feee879f4ff2f1aa9440178272efa68f4bd66aede6f92c5",
      "license": "MIT",
      "repair": null,
      "packs": [
        "core"
      ]
    },
    {
      "path": ".github/skills/ce-brainstorm/SKILL.md",
      "upstream": "atv",
      "upstream_path": "pkg/scaffold/templates/skills/ce-brainstorm/SKILL.md",
      "stored_at": ".github/skills/ce-brainstorm/SKILL.md",
      "sha256_upstream": "4cee9e3e842ae657a0ecfb02a06823e59969c773f2184564934db721ae62c2a6",
      "sha256": "4cee9e3e842ae657a0ecfb02a06823e59969c773f2184564934db721ae62c2a6",
      "license": "MIT",
      "repair": null,
      "packs": [
        "core"
      ]
    },
    {
      "path": ".github/skills/ce-compound/assets/resolution-template.md",
      "upstream": "atv",
      "upstream_path": "pkg/scaffold/templates/skills/ce-compound/assets/resolution-template.md",
      "stored_at": ".github/skills/ce-compound/assets/resolution-template.md",
      "sha256_upstream": "e2aa5cf7e01b1d2ae08317863d011cb0b384bbf683bd2cab885a486f5b9cdd3b",
      "sha256": "e2aa5cf7e01b1d2ae08317863d011cb0b384bbf683bd2cab885a486f5b9cdd3b",
      "license": "MIT",
      "repair": null,
      "packs": [
        "core"
      ]
    },
    {
      "path": ".github/skills/ce-compound/references/schema.yaml",
      "upstream": "atv",
      "upstream_path": "pkg/scaffold/templates/skills/ce-compound/references/schema.yaml",
      "stored_at": ".github/skills/ce-compound/references/schema.yaml",
      "sha256_upstream": "5787641cc2bb0a6f4df36e7aded4db898e47308284e0699b165605eb6731e36b",
      "sha256": "5787641cc2bb0a6f4df36e7aded4db898e47308284e0699b165605eb6731e36b",
      "license": "MIT",
      "repair": null,
      "packs": [
        "core"
      ]
    },
    {
      "path": ".github/skills/ce-compound/references/yaml-schema.md",
      "upstream": "atv",
      "upstream_path": "pkg/scaffold/templates/skills/ce-compound/references/yaml-schema.md",
      "stored_at": ".github/skills/ce-compound/references/yaml-schema.md",
      "sha256_upstream": "5715d8c066060f93135b6f5536e9329b2cdb07d09fc134b3e26f9efc2a8a7608",
      "sha256": "5715d8c066060f93135b6f5536e9329b2cdb07d09fc134b3e26f9efc2a8a7608",
      "license": "MIT",
      "repair": null,
      "packs": [
        "core"
      ]
    },
    {
      "path": ".github/skills/ce-compound/SKILL.md",
      "upstream": "atv",
      "upstream_path": "pkg/scaffold/templates/skills/ce-compound/SKILL.md",
      "stored_at": ".github/skills/ce-compound/SKILL.md",
      "sha256_upstream": "c66afa7af2676ab36aa2fca6aa527958fb4391742dab8a05bf82e7b367190b70",
      "sha256": "c66afa7af2676ab36aa2fca6aa527958fb4391742dab8a05bf82e7b367190b70",
      "license": "MIT",
      "repair": null,
      "packs": [
        "core"
      ]
    },
    {
      "path": ".github/skills/ce-review/references/diff-scope.md",
      "upstream": "atv",
      "upstream_path": "pkg/scaffold/templates/skills/ce-review/references/diff-scope.md",
      "stored_at": ".github/skills/ce-review/references/diff-scope.md",
      "sha256_upstream": "b11a3cbee8372bc4162a2e00898e82317b37c5f56cbf456fe81c3e5fef1ff989",
      "sha256": "b11a3cbee8372bc4162a2e00898e82317b37c5f56cbf456fe81c3e5fef1ff989",
      "license": "MIT",
      "repair": null,
      "packs": [
        "core"
      ]
    },
    {
      "path": ".github/skills/ce-review/references/findings-schema.json",
      "upstream": "atv",
      "upstream_path": "pkg/scaffold/templates/skills/ce-review/references/findings-schema.json",
      "stored_at": ".github/skills/ce-review/references/findings-schema.json",
      "sha256_upstream": "2ddc30b034071836fad3ded0d75af5f67cbd7bbd7f973b9d6070d748be76e8c3",
      "sha256": "2ddc30b034071836fad3ded0d75af5f67cbd7bbd7f973b9d6070d748be76e8c3",
      "license": "MIT",
      "repair": null,
      "packs": [
        "core"
      ]
    },
    {
      "path": ".github/skills/ce-review/references/persona-catalog.md",
      "upstream": "atv",
      "upstream_path": "pkg/scaffold/templates/skills/ce-review/references/persona-catalog.md",
      "stored_at": ".github/skills/ce-review/references/persona-catalog.md",
      "sha256_upstream": "15ee8f3e6add6c4f08d091f5252a9298e48784329629f277182b7867a1d0f75f",
      "sha256": "15ee8f3e6add6c4f08d091f5252a9298e48784329629f277182b7867a1d0f75f",
      "license": "MIT",
      "repair": null,
      "packs": [
        "core"
      ]
    },
    {
      "path": ".github/skills/ce-review/references/resolve-base.sh",
      "upstream": "atv",